{
  "entry_id": "CHR-2026-0001",
  "schema_id": "chronicle-entry",
  "schema_version": "1.0.0",
  "entry_version": 1,
  "title": "Creation of SC-CERT-2026-0001",
  "summary": "Satoshium Certifier issued the authoritative Certification Package SC-CERT-2026-0001 on July 5, 2026, establishing the inaugural Operational certification of the Satoshium Atlas Jurisdiction Record — El Salvador.",
  "event_type": "certification_created",
  "event_date": "2026-07-05",
  "historical_context": "SC-CERT-2026-0001 marked the inaugural Operational certification issued by Satoshium Certifier. The certification concerned the Satoshium Atlas Jurisdiction Record — El Salvador and established an early operational relationship among Atlas source authority, Certifier certification authority, and subsequent Registry registration. Its issuance represents a milestone in the transition of the Satoshium Suite from institutional architecture into cross-system operational use.",
  "event_type_profile": "certification-event-profile",
  "originating_system": "certifier",
  "authoritative_record_references": [
    {
      "reference": "SC-CERT-2026-0001",
      "system": "certifier",
      "record_type": "Certification Package",
      "url": "https://satoshium.us/certifier/certifications/SC-CERT-2026-0001/"
    }
  ],
  "source_references": [
    {
      "reference": "Certification Process Report for SC-CERT-2026-0001",
      "system": "certifier",
      "record_type": "Certification Process Report",
      "url": "https://satoshium.us/certifier/certifications/SC-CERT-2026-0001/reports/certification-process-report/"
    },
    {
      "reference": "Certification Receipt for SC-CERT-2026-0001",
      "system": "certifier",
      "record_type": "Certification Receipt",
      "url": "https://satoshium.us/certifier/certifications/SC-CERT-2026-0001/receipts/certification-receipts/"
    },
    {
      "reference": "SCRD-SC-CERT-2026-0001",
      "system": "certifier",
      "record_type": "Satoshium Certified Record",
      "url": "https://satoshium.us/certifier/certifications/SC-CERT-2026-0001/records/certified-record/"
    },
    {
      "reference": "SCRD-SC-CERT-2026-0001",
      "system": "certifier",
      "record_type": "Satoshium Certified Record JSON",
      "url": "https://satoshium.us/certifier/certifications/SC-CERT-2026-0001/records/certified-record/scrd_json.json"
    }
  ],
  "relationships": [
    {
      "type": "related_to",
      "target": "SREG-2026-0001",
      "target_system": "registry",
      "context": "Registry Entry cataloging SC-CERT-2026-0001."
    },
    {
      "type": "references",
      "target": "Atlas Jurisdiction Record — El Salvador",
      "target_system": "atlas",
      "context": "Authoritative Atlas subject record evaluated by SC-CERT-2026-0001."
    }
  ],
  "provenance": {
    "origin": "Satoshium Certifier",
    "acquisition_method": "production_review_of_authoritative_and_supporting_suite_records",
    "retrieved_at": "2026-08-22T08:06:00-07:00",
    "authoritative_record_reference": {
      "reference": "SC-CERT-2026-0001",
      "system": "certifier",
      "record_type": "Certification Package",
      "url": "https://satoshium.us/certifier/certifications/SC-CERT-2026-0001/"
    },
    "preservation_path": [
      "Satoshium Atlas",
      "Atlas Jurisdiction Record — El Salvador",
      "Satoshium Certifier",
      "SC-CERT-2026-0001",
      "Satoshium Registry",
      "SREG-2026-0001",
      "Satoshium Chronicle",
      "CHR-2026-0001"
    ]
  },
  "verification_state": "verified",
  "lifecycle_state": "active",
  "publication_state": "published",
  "entry_created_at": "2026-08-22T08:06:00-07:00",
  "published_at": "2026-08-22T08:38:00-07:00"
}
